Ticket Number,User ID,Application,Problem Type,Problem Description,Status,Email
TICKET-1,1003,Procu,login_issue,The login page is not working,Unresolved,kunal@gmail.com
TICKET-2,121,vasturea,login_issue,unable to login redirecting back every time,Unresolved
TICKET-3,121,vasturea,New,khana nhi mil rha,Unresolved
TICKET-4,4556,procu,login_issue,Login related issue,Unresolved
TICKET-5,1001,Pensire,registration_issue,i am not understanding it properly,Unresolved
TICKET-6,123,vastuteq,login_issue,login,Unresolved
TICKET-7,tykunal@12,pensire,support_issue,I haven't generated a ticket while i shoud've now at this moment.,Unresolved
